{
  "$schema": "http://json-schema.org/draft-07/schema#",
  "title": "Flow Icons for Zed - Configuration",
  "description": "Customize how Flow Icons renders in Zed. After editing, run `node update-icons.cjs` to rebuild the icon theme and restart Zed.",
  "type": "object",
  "additionalProperties": false,
  "definitions": {
    "hexColor": {
      "type": "string",
      "pattern": "^#([0-9a-fA-F]{3}|[0-9a-fA-F]{6})$",
      "description": "Hex color (3- or 6-digit, with leading #)."
    },
    "youPaletteEntries": {
      "type": "object",
      "additionalProperties": false,
      "properties": {
        "white": { "$ref": "#/definitions/hexColor" },
        "black": { "$ref": "#/definitions/hexColor" },
        "blue": { "$ref": "#/definitions/hexColor" },
        "brown": { "$ref": "#/definitions/hexColor" },
        "gray": { "$ref": "#/definitions/hexColor" },
        "green": { "$ref": "#/definitions/hexColor" },
        "lime": { "$ref": "#/definitions/hexColor" },
        "orange": { "$ref": "#/definitions/hexColor" },
        "pink": { "$ref": "#/definitions/hexColor" },
        "purple": { "$ref": "#/definitions/hexColor" },
        "red": { "$ref": "#/definitions/hexColor" },
        "sky": { "$ref": "#/definitions/hexColor" },
        "teal": { "$ref": "#/definitions/hexColor" },
        "yellow": { "$ref": "#/definitions/hexColor" },
        "border": {
          "$ref": "#/definitions/hexColor",
          "description": "Optional border outline color. Defaults to `contrast` (which itself defaults to `white` in dark mode, `black` in light mode)."
        },
        "contrast": {
          "$ref": "#/definitions/hexColor",
          "description": "Optional contrast color. Defaults to `white` in dark mode, `black` in light mode."
        },
        "borderOpacity": {
          "type": "number",
          "minimum": 0,
          "maximum": 1,
          "description": "Border opacity (0-1). Set to 0 to hide borders entirely."
        }
      }
    }
  },
  "properties": {
    "$schema": {
      "type": "string",
      "description": "Schema reference for editor autocomplete."
    },
    "folderColor": {
      "type": "string",
      "description": "Default folder color. Each palette ships a matching folder_<color>{,_open}.svg used for unnamed directories.",
      "enum": [
        "gray",
        "blue",
        "brown",
        "green",
        "lime",
        "orange",
        "pink",
        "purple",
        "red",
        "sky",
        "teal",
        "yellow"
      ],
      "default": "gray"
    },
    "specificFolders": {
      "type": "boolean",
      "description": "If false, all directories use the default folder icon (no per-name folder icons like `src`, `tests`, `components`).",
      "default": true
    },
    "filesReplacements": {
      "type": "object",
      "description": "Swap one file icon for another - typically used to opt into '-alt' variants. Keys and values may use either hyphens or underscores (`rust-alt` and `rust_alt` are equivalent). Both icons must exist as SVGs in each palette folder.",
      "additionalProperties": {
        "type": "string"
      },
      "examples": [
        {
          "rust": "rust-alt",
          "kotlin": "kotlin-alt",
          "go": "go-alt"
        }
      ]
    },
    "foldersReplacements": {
      "type": "object",
      "description": "Swap one folder icon for another. Keys are the icon's base name without the `folder_` prefix (e.g. `components`, not `folder_components`). Both icons must exist as `folder_<name>{,_open}.svg` in each palette folder.",
      "additionalProperties": {
        "type": "string"
      },
      "examples": [
        {
          "components": "react-components"
        }
      ]
    },
    "filesAssociations": {
      "type": "object",
      "description": "Map a file extension or filename to a specific icon. Compatible with Material Icon Theme syntax: `*.ext` for extensions, plain text for exact filenames, `dir/...` for paths inside a folder. Set the value to an empty string to remove an existing association.",
      "additionalProperties": {
        "type": "string"
      },
      "examples": [
        {
          "*.tss": "typescript",
          "tailwind.css": "tailwindcss",
          "src/index.js": "javascript-other",
          "package.json": ""
        }
      ]
    },
    "foldersAssociations": {
      "type": "object",
      "description": "Map a folder name to a specific icon. The value is the folder icon's base name (without the `folder_` prefix). Set the value to an empty string to remove an existing association.",
      "additionalProperties": {
        "type": "string"
      },
      "examples": [
        {
          "store": "resource",
          "data": ""
        }
      ]
    },
    "youColors": {
      "type": "object",
      "additionalProperties": false,
      "description": "Custom color palette for the **Flow You** icon theme. Top-level keys define dark-mode colors. Add a `light` sub-object to override light-mode colors (otherwise light is auto-derived by darkening each dark-mode color). Any key you omit falls back to the default monochromatic slate palette. See https://github.com/thang-nm/Flow-Icons/tree/main/you for sample palettes.",
      "properties": {
        "white": { "$ref": "#/definitions/hexColor" },
        "black": { "$ref": "#/definitions/hexColor" },
        "blue": { "$ref": "#/definitions/hexColor" },
        "brown": { "$ref": "#/definitions/hexColor" },
        "gray": { "$ref": "#/definitions/hexColor" },
        "green": { "$ref": "#/definitions/hexColor" },
        "lime": { "$ref": "#/definitions/hexColor" },
        "orange": { "$ref": "#/definitions/hexColor" },
        "pink": { "$ref": "#/definitions/hexColor" },
        "purple": { "$ref": "#/definitions/hexColor" },
        "red": { "$ref": "#/definitions/hexColor" },
        "sky": { "$ref": "#/definitions/hexColor" },
        "teal": { "$ref": "#/definitions/hexColor" },
        "yellow": { "$ref": "#/definitions/hexColor" },
        "border": {
          "$ref": "#/definitions/hexColor",
          "description": "Optional border outline color. Defaults to `contrast` (which itself defaults to `white` in dark mode)."
        },
        "contrast": {
          "$ref": "#/definitions/hexColor",
          "description": "Optional contrast color. Defaults to `white` in dark mode."
        },
        "borderOpacity": {
          "type": "number",
          "minimum": 0,
          "maximum": 1,
          "description": "Border opacity (0-1). Set to 0 to hide borders entirely."
        },
        "light": {
          "$ref": "#/definitions/youPaletteEntries",
          "description": "Light-mode overrides. Any key you set here wins over the auto-derived darken() value."
        }
      },
      "examples": [
        {
          "white": "#bfbdb6",
          "black": "#0d1017",
          "blue": "#59c2ff",
          "green": "#aad94c",
          "orange": "#ff8f40",
          "red": "#f07178",
          "yellow": "#ffcb8f",
          "borderOpacity": 0,
          "light": {
            "borderOpacity": 0.1
          }
        }
      ]
    }
  }
}
